,,,,,,,,,,,,,,,,,,,,,,,,,,,,,,
Table 4: Transmission Wires Down 2015-2019,,,,,,,,,,,,,,,,,,,,,,,,,,,,,,
T-Line Area,kV,SAP Functional Location,LINE NO,T-LINE NAME,Fire Index Area (FIA),Location(s) of ET-Wire Down,High Fire Threat District (HFTD),YEAR,Date Out,Major Event Day,Red Flag Day,Failure during Red Flag Warning (RFW) Hours?,Auto Reclose Disabled,Duration (hr:min),Date In,Cause Category,Cause Details,Comments,Event Report,TOTL Reference Number,Customers Affected,Customers Experiencing Sustained Outage,Customer Outage Minutes,SAIFI Contribution,SAIDI Contribution,CAIDI,System Customer Count,Fault Type,Fault Location,Ignition
NORTH,60,ETL.6610,60053,CORTINA #4,0,"B15/253, 014/234",Non-HFTD,2015,01/12/2015 11:55,No,No,NO,No,11:26,01/12/2015 23:21,External Contact,Car pole,"Relayed - 01/12/15, 1155 Cortina #4-60kV relayed, tested NG; SUS Maxwell (1,136, 124,417) & Rice (1,002, 18.036); weather clear; 1212 Rice restored from alternate source; PG&E phase AC to ground, 14.8 mi from Cortina near structure 14/234 (+/- 0.5 mi); 1327 Cortina-Colusa returned to service restoring Maxwell; 1336 to 2321 MaxwellJct-Delevan cleared to replace damaged pole B-15/253 due to car pole; ET wire down",10835,TM-2015-002,"2,138","2,138","142,453",0.0004,0.026,67,"5,446,629",NA,NA,No
NORTH,60,ETL.7030,60098,HAT CREEK #1-WESTWOOD,249; 250; 262; 290,"018/349, 018/351, 025/484, 025/487, 025/489, 026/510 to 026/512, 026/514 to 026/518, 027/520 to 027/527, 027/530, 032/621 to 032/627 & 032/632, 038/748, 039/751, 039/765, 040/766, 040/768, 040/770 to 040/773, 040/776, 040/768",Tier 2 - Elevated,2015,02/06/2015 00:24,YES,No,NO,No,118:04,02/10/2015 22:28,Tree,Tree failure,"Relayed - 02/06/15, 0024 HatCreek #1-Westwood 60kV relayed, tested NG; SUS MegaHatCreek , Halls Flat & Bogard (9); storm; 0356 HatCreek #1-Bogard manually tested NG to open Bogard SW-37; 0401 Westwood-Bogard manually tested NG to open Bogard SW-37, hence trouble on both sides of Bogard SW-37; trees down in line affecting multiple structures; 02/10/15, 0101 HatCreek #1-Bogard returned to service restoring MegaHatCreek, Halls Flat & Bogard after crews made repairs to poles: 18/349, 18/351, 25/484, 25/487, 25/489, 26/510 to 26/512, 26/514 to 26/518, 27/520 to 27/527, 27/530, 32/621 to 32/627 & 32/632; 1908 Bogard-Westwood cleared to repair poles: 38/748, 39/751, 39/765, 40/766, 40/768, 40/770 to 40/773, 40/776, 40/768; 2228 line returned normal",10912,RM-2015-006,9,9,"52,209",0.0000,0.010,"5,801","5,446,629",NA,NA,No
NORTH,60,ETL.6980,60093,GUALALA-MONTE RIO,0; 140,"050/002, 053/009 & 054/000",Tier 2 - Elevated,2015,02/06/2015 08:14,YES,No,NO,No,10:50,02/06/2015 19:04,Tree,Tree failure,"Relayed - 02/06/15, 0814 Gualala-MonteRio 60kV relayed, tested NG; MonteRio-FtRoss tested OK; Gualala transferred on trouble to its alt source; MOM FtRoss (637), SalmonCreek (1,720) & Gualala (3,710); SUS Annapolis (230); storm;; fault ABC, 36 mi from MonteRio near pole 50/2 (+/- 1.0 mi); 0951 FtRoss-Annapolis energized restoring Annapolis; 1258 Annapolis-Gualala tested NG from the Elk source; MOM Garcia, PtArena & Gualala; 1514 found tree in line & all 3 phases are down on ground bet poles 53/9 & 54/0; Gualala-Annapolis has been cleared to make repairs; 1904 Gualala-Annapolis & line returned to service after crew repaired down conductor",10877,FU-2015-005,"6,297",216,"81,216",0.0000,0.015,376,"5,446,629",NA,NA,No
NORTH,500,ETL.6140,50021,VACA-TESLA,0,000/003-004,Non-HFTD,2015,02/06/2015 08:57,YES,No,NO,No,17:09,02/07/2015 02:06,Equipment Failure,Insulator-line,"Relayed - 02/06/15, 0857 Vaca-Tesla 500kV & Vaca 500/230kV BK12 relayed, did not test by design; no customer interruption; storm; 0935 line manually tested NG; C-G (relay B-G), 1 to 2 mi from VD; no bk diff or high side relay opn, only low side grd instantaneous-BK may be restored (BK overtrip similar to Gates & all bks under investigation & setting changes made as needed); 1046 BK12 returned to service, no trouble found; 1355 Vaca-Tesla cleared to repair broken insulator & re-attach conductor bet twrs 0/3-4; Vaca-Tesla 500kV line Series CAP BK2 at Vaca has a pole disagreement & close coil trouble; 02/07/15, 0206 line returned to service; 02/09/15, 1635 CAP BK2 returned to service, repaired pole disagreement alarm wiring",10888,VD-2015-011,0,0,0,0.0000,0.000,0,"5,446,629",NA,NA,No
NORTH,60,ETL.6300,60018,CARIBOU-WESTWOOD,285; 290,"018/366, 006/126-130, 002/035-040, 009/187-189, 009/202, 018/364 & 018/365 & 018/368 thru 018/371, 018/367",Tier 2 - Elevated,2015,02/06/2015 09:18,YES,No,NO,No,98:23,02/10/2015 11:41,Tree,Tree failure,"Relayed – 02/06/15, 0918 Caribou-Westwood relayed, tested NG; storm; SUS LMUD, BigMeadows (2,597), Chester (1,647), CollinsPine (offline) & HamiltonBranch (2,320); A- C fault 18.5 mi from Caribou PH bet HamBranch & UltraPwrJct near pole 018/366, +/- 1.5 mi; HatCreek #1-Westwood out so no back feed available; poles 6/126-130 need replacement; 02/08/15, 1822 Caribou-BigMeadows energized restoring BigMeadows, repaired NG splices & reframed poles bet 2/35-40; 2358 BigMeadows-HamBranch tested OK, reconnected conductor at pole 9/187, reframed poles 9/188-189; 02/09/15, 0011 HamBranch restored; 0026 HamBranch-Chester manually tested NG; 1021 HamBranch-Chester sect returned to service after crew removed tree limb @ pole 9/202 restoring Chester & CollinsPine; 02/09/15, 2210 HamBranch-Westwood sect returned to service making line normal after crews replaced pole 18/367, reframed poles 18/364 & 18/365 & 18/368 thru 18/371; 02/10/15, 1141 Caribou-Westwood has returned to service",11045,TM-2015-007,"5,753","5,753","23,442,069",0.0011,4.304,"4,075","5,446,629",NA,NA,No
NORTH,60,ETL.6490,60040,COLGATE-GRASS VALLEY,330,003/080-085,Tier 2 - Elevated,2015,02/06/2015 11:55,YES,No,NO,No,36:53,02/08/2015 00:48,Tree,Tree failure,"Relayed - 02/06/15, 1155 Colgate-GrassValley relayed, tested NG; MOM GrassValley (3,369 customers restored by autos via alt source Drum-GrassValley-Weimar); rain, wind; ABC fault 3.4 mi from ColgateSwSta near pole 003/081 (+/- 1 mi); tree thru line bet poles 3/81-82; pole 3/81 is broken & on ground, ET wire down bet 3/80-85; ETOR 02/07/15; 02/07/15, 2122 Colgate-BirchvilleJct work complete - replaced pole 3/81, reframed pole 3/82 & repaired down conductor between poles 3/80 and 3/85; 2143 line section remotely tested OK from GrassValley; 02/08/15, 0048 line returned to normal service; eventID=10886",10886,TM-2015-011,"3,369",0,0,0.0000,0.000,0,"5,446,629",NA,NA,No
NORTH,60,ETL.6470,60038,COLGATE-ALLEGHANY,330; 350,"007/209, 010/283",Tier 3 - Extreme,2015,02/06/2015 12:34,YES,No,NO,No,12:22,02/07/2015 00:56,Tree,Tree failure,"Relayed - 02/06/15, 1234 Colgate-Alleghany relayed, tested NG after relaying, testing OK @ 1219; MOM ColumbiaHill (1,131) after Colgate-ColumbiaHill energized @ 1238; SUS PikeCity (437) & Alleghany (1,230); wind, rain; AB fault, 8 mi from ColgateSwSta bet ColumbiaHill & PikeCity near pole 007/209, +/- 2 mi; 1745 ColumbiaHill-PikeCity cleared to repair 3 phases of ET wire down at pole 10/283; 2353 CH-PC in service after repairing down conductor at 10/283; 02/07/15, 0056 PikeCity-Alleghany returned to service after patrol found no trouble, restoring Alleghany; 0106 PikeCity restored; eventID=10885",10885,TM-2015-013,"1,655","1,655","1,913,907",0.0003,0.351,"1,156","5,446,629",NA,NA,No
NORTH,60,ETL.7780,60390,PHILO JCT-ELK,0; 140; 154,024/000-001,Tier 2 - Elevated,2015,02/06/2015 16:06,YES,No,NO,No,29:41,02/07/2015 21:47,Tree,Tree failure,"Relayed - 02/06/15, 1606 PhiloJct-Elk 60kV relayed, tested NG; MOM Philo (2,163); wind, rain; ABC fault 23.8 mi from PhiloJct near pole 24/0, +/- 0.2 mi; found broken poles & ET wire down bet 24/1 & 24/0; 02/07/15, 2147 PhiloJct-Elk section returned to service after repair to downed conductor between poles 24/0-1; eventID=10878",10878,FU-2015-007,"2,163",0,0,0.0000,0.000,0,"5,446,629",NA,NA,No
CENTRAL,60,ETL.7550,60151,MENDOCINO-WILLITS-FORT BRAGG,0; 140; 154,"034/001-002, 035/009",Tier 2 - Elevated,2015,02/06/2015 21:55,YES,No,NO,No,9:27,02/07/2015 07:22,Tree,Tree failure,"Relayed - 02/06/15, 2155 Mendo-Willits-FtBragg relayed, tested NG; SUS FtBragg (FB, 8,273); wind & rain; ABC fault 7 mi from FB near pole 35/9, +/- 3 mi; 02/07/15, 0722 line returned to service after crew repaired ET wire down bet poles 34/1-2 due to tree failure; 0728 FB restored; eventID=10879",10879,FU-2015-008,"7,502","7,502","4,253,634",0.0014,0.781,567,"5,446,629",NA,NA,No
NORTH,60,ETL.6470,60038,COLGATE-ALLEGHANY,330; 350,020/555 & 022/555,Tier 3 - Extreme,2015,02/07/2015 11:18,YES,No,NO,No,12:01,02/07/2015 23:19,Equipment Failure,Connector/ hardware,"Relayed - 02/07/15, 1118 Colgate-Alleghany 60kV relayed, tested NG; weather cloudy; 1122 Colgate-PikeCity manually tested OK; MOM (<5 mins) Columbia Hill (1,131) & PikeCity (437); SUS Alleghany (1,230); unconfirmed reports of wire down 6 poles from Pike City to Alleghany; fault location delayed: remote access dial up problems; 1207 reports of damage to pole 20/555; 1426 PlumValley-BuhlRanch cleared to re-attach conductor to pole 22/555; CLEAN BREAK AT JUMPER, CONDUCTOR x-PHASED, MADE CONTACT W/ POLE & STARTED A FIRE - POLE SNAPPED AS A RESULT; 2319 PlumValley-Alleghany returned to service restoring Alleghany; eventID=10883",10883,TM-2015-019,"2,798","1,230",TBD,TBD,TBD,TBD,"5,446,629",NA,NA,No
NORTH,60,ETL.7780,60390,PHILO JCT-ELK,0; 140; 154,"021/005, 021/011, 022/000",Tier 2 - Elevated,2015,02/08/2015 21:00,YES,No,NO,No,12:10,02/09/2015 09:10,Tree,Tree failure,"Relayed - 02/08/15, 2100 PhiloJct-Philo section of PhiloJct- Elk 60 kV relayed, tested OK; MOM Philo (2,163); on the trouble Philo-Elk remained de-energized; wind & rain; A-B fault 15.5 mi from Elk or 2.5 mi from Philo Tap twd Elk near pole 21/5, +/- 1.0 mi; 02/09/15, 02/09/15, 0230 Philo-GreenwoodRoad section cleared to repair 3 phases of ET wire down at pole 21/11 and one phase of downed conductor at pole 22/0; 0909 Philo-Elk section manually tested OK; 0910 Elk restored; eventID=10909",10909,FU-2015-016,"2,163",0,0,0.0000,0.000,0,"5,446,629",NA,NA,No
CENTRAL,60,ETL.7550,60151,MENDOCINO-WILLITS-FORT BRAGG,0; 140; 154,"031/003-004, 019/000",Tier 2 - Elevated,2015,02/08/2015 21:18,YES,No,NO,No,43:36,02/10/2015 16:54,Tree,Tree failure,"Relayed - 02/08/15, 2118 Mendo-Willits-FtBragg relayed, tested NG; SUS FtBragg (8,273) & BigRiver (2,699); wind & rain; A-G 19.4 mi from Mendo near pole 19/5, +/- 1.0 mi; 02/09/15, 0420 EastHill-McGuireMill cleared to remove tree limb & 100' fir tree, caused 3 phases of ET wire down at pole 19/0 w/ under build trouble; 1638 McGuireMillJct-FtBragg section cleared to repair ET wire down bet poles 31/3-4 (canyon); 02/10/15, 1654 Mendo-W-FB (McGuireMillJct-FtBragg) returned to service; eventID=10901",10901,FU-2015-013,"6,971","6,971","8,623,205",0.0013,1.583,"1,237","5,446,629",NA,NA,No
CENTRAL,115,ETL.3980,10474,TESLA-SCHULTE SW STA #1,0,"002/002 & 002/003, 000/003",Non-HFTD,2015,02/08/2015 22:51,YES,No,NO,No,21:04,02/09/2015 19:55,Equipment Failure,Structure-line,"Relayed - 02/08/15, 2251  Tesla-SchulteSwSta #1-115kV relayed, tested NG; SUS AEC Site 300; wind & rain; PG&E phase B-G on initial fault & 3-Phase on NG line test, 6.6 mi from Tesla near pole 0/3 on AEC 115kV tap (accuracy of loc=high); reports of 2 broken poles, 2/2 & 2/3 w/ 3 phases of ET wire down on AEC Site #115kV Tap beyond SW-145; 02/09/15, 0606 line restored to service after AEC Site #2-115kV Tap SW-145 was opened to isolate trouble; 1955 AEC Site #2 Tap returned to normal restoring  AEC Site 300 after crews made repairs to poles 2/2 & 2/3; eventID=10903",10903,TE-2015-008,1,0,0,0.0000,0.000,0,"5,446,629",NA,NA,No
NORTH,60,ETL.7780,60390,PHILO JCT-ELK,0; 140; 154,"018/009 & 018/011, 008/004",Tier 2 - Elevated,2015,02/09/2015 14:24,No,No,NO,No,10:38,02/10/2015 01:02,Tree,Tree failure,"Relayed - 02/09/15, 1424 PhiloJct-Elk relayed, tested NG; Elk-Gualala & FtBragg-Elk de-energized on the trouble; SUS Elk, BigRiver, FortBragg, & Philo; MOM PtArena & Garcia; high winds; A-B-C 18.5 mi from PhiloJct twd Philo Tap near pole 8/4, +/- 1.0 mi; 1700 PhiloJct-Philo section cleared to repair 3 spans of ET wire down between poles 18/9 & 18/11 due to tree contact; 2308 Philo restored; 2355 Philo-Elk section returned to service; 02/10/15, 0043 Elk restored; 0052 FtBragg-Elk energized restoring FtBragg & Big River; 0102 line returned normal; eventID=10910",10910,FU-2015-018,"5,788","5,788","4,281,786",0.0011,0.786,740,"5,446,629",NA,NA,No
SOUTH,115,ETL.1930,10119,KERN-KERN FRONT,0,011/167,Non-HFTD,2015,02/10/2015 04:02,No,No,NO,No,14:59,02/10/2015 19:01,Equipment Failure,Insulator-line,"Relayed - 02/10/15, 0402 Kern-KernFront 115kV relayed, tested NG; KERN CB-272 WAS SLOW TO OPEN so TROUBLE BACKED UP INTO KERN PP 115KV BUS CAUSING #1 BUS SECTs D & E & #2 BUS SECT D TO CLEAR FAULT (see eventID=10664 for similar operation of CB on 10/24/14); Kern 115kV bus #1 sect D & E, bus #2 section D, Lamont #1 & #2-115kV bus, Kern #1-115/60kV xfmr, Kern #6 & #7-115/21kV xfmrs, 7thStandard-Kern, Kern-Tevis-Stockdale, Kern-Tevis-Stockdale-Lamont, AdobeSwSta-Lamont, Kern-Westpark #2, Lamont-Grimmway-Malaga, Westpark-Magunden 115kV lines, Kern 70kV bus #1, Kern-OldRiver #1 & Kern-Fruitvale 70kV lines de-energized on the trouble; SUS KernFront cogen, DoubleC cogen, HighSierra cogen, BadgerCreek cogen, Westpark #2 & #3-115/12kV xfmrs, BearMtn cogen & CalWater; MOM 7thStandard, Tevis, Stockdale #1 & #4-115/12kV xfmrs, ArvinEdison, Lamont, Grimmway-Malaga, Regulus PV Solar, Adobe PV, Columbus & BolthouseFarms; weather clear; 0444 Kern-Westpark #2-115kV energized restoring Westpark #2 & #3-115/12kV xfmrs.  0511 Westpark to Columbus section energized restoring Bear Mountain cogen & CalWater; 0854 Kern-KernFront cleared to repair broken & flashed insulators at pole 11/167; 1901 Kern-KernFront returned to service restoring KernFront cogen, DoubleC cogen, HighSierra cogen & BadgerCreek cogen; eventID=10902",10902,MD-2015-004,4,0,0,0.0000,0.000,0,"5,446,629",NA,NA,No
NORTH,60,ETL.6280,60016,CARIBOU #2,285,016/017,Tier 2 - Elevated,2015,02/15/2015 17:37,No,No,NO,No,31:58,02/17/2015 01:35,Tree,Tree failure,"Relayed - 02/15/15, 1737 Caribou #2-60kV relayed, tested NG; SUS GraysFlat, SpanishCreek & Gansner; weather clear; 1757 Gansner restored; 1845 GraysFlat & SpanishCreek restored; 2317 Caribou-GraysFlat cleared to repair 2 phases of ET wire down due to tree in line at structure 16/17 (60kV into 4kV); ETOR 02/16/15; 02/17/15, 0135 line returned to service; eventID=10927",10927,TM-2015-021,"2,745","2,745","242,141",0.0005,0.044,88,"5,446,629",NA,NA,No
NORTH,60,ETL.7850,60184,RIO DELL JCT-BRIDGEVILLE,0; 100; 105; 120,037/006-007,Non-HFTD,2015,02/23/2015 07:19,No,No,NO,No,11:00,02/23/2015 18:19,Tree,Tree failure,"Relayed - 02/23/15, 0719 RioDellJct-Bridgeville relayed, tested NG; SUS Humboldt Redwood & Carlotta; windy; C-G fault, 2.9 mi from Bridgeville near pole 37/7, +/- 0.3 mi; 0902 RioDellJct-CarlottaJct manually tested OK, restoring Carlotta & Humboldt Redwood; 1645 Bridgeville-Carlotta tested OK; 1717 line returned normal, however, 1727 RioDellJct CB-22 forced out to add SF6 gas; 1819 CB-22 returned &  line returned normal; repaired ET wire down bet poles 37/6-7 after tree fell into line, & added SF6 gas to CB-22; eventID=10926",10926,HM-2015-006,"1,126","1,126","115,978",0.0002,0.021,103,"5,446,629",NA,NA,No
NORTH,115,ETL.2170,10143,MADISON-VACA,0; 177,047/290,Tier 2 - Elevated,2015,02/28/2015 06:13,No,No,NO,No,14:45,02/28/2015 20:58,External Contact,Foreign object,"Relayed - 02/28/15, 0613  Madison-Vaca relayed tested NG; SUS Madison; weather clear; no SCADA switching at Madison; A-G fault, 6.5 mi from Vaca, +/- 2 mi; 0755 Madison restored via RioOso-Woodland #1; 2058 line returned to svc, repaired ET wire down at tower 47/290; per TLine specialist, appears that there was contact by a bird streamer or nesting material; eventID=10941",10941,VD-2015-018,"4,111","4,111","408,928",0.0008,0.075,99,"5,446,629",NA,NA,No
SOUTH,70,ETL.8480,70006,ATASCADERO-CAYUCOS,0; 508; 575,008/073-074,Tier 2 - Elevated,2015,03/07/2015 09:11,No,No,NO,No,8:41,03/07/2015 17:52,Equipment Failure,Conductor,"Relayed - 03/07/15, 0911 Atascadero-Cayucos relayed, tested NG; no customer interruption, although wire came down across 12kV underbuild de-energizing customers; 1112 to 1752 line cleared to repair ET wire down (failed mid-span between poles 8/73-74, apparent corrosion just outside armor rod -sent to Asset Strategy for analysis; CAUSED 5285 FUSES TO BLOW & sustained outage to 42 customers on Cayucos 1102 (CAIDI-246 minutes); eventID=",10969,DW-2015-005,42,42,"10,332",0.0000,0.002,246,"5,446,629",NA,NA,No
NORTH,60,ETL.6280,60016,CARIBOU #2,285,"019/011 or 001/015, 019/014-015",Tier 2 - Elevated,2015,03/14/2015 05:26,No,No,NO,No,8:17,03/14/2015 13:43,Tree,Tree failure,"Relayed - 03/14/15, 0526 Caribou #2-60kV relayed, tested NG; SUS SpanishCreek (906, 146,772), GraysFlat (123, 15,990) & Gansner (1,717, 104,737); rain; 0627 Gansner restored via distribution switching; 0736 Caribou-GraysFlat tested OK restoring GraysFlat; 0808 SpanishCreek-BlackHawk tested OK restoring SpanishCreek; ABC fault 19.3 miles from Caribou near pole 19/11 or 1/15 (patrol should start at Grays Flat out twd Spanish Creek or Elizabethtown), +/- 1 mi; 1026 to 1343 GraysFlat-SpanishCreek cleared to remove tree & replace 1 span of 3 phase conductor bet poles 19/14-15; eventID=10974",10974,TM-2015-024,"2,746","2,746","267,499",0.0005,0.049,97,"5,446,629",NA,NA,No
NORTH,115,ETL.4393,10459,DRUM-HIGGINS,300; 330; 350,023/180,Tier 2 - Elevated,2015,03/29/2015 10:28,No,No,NO,No,10:06,03/29/2015 20:34,Tree,Tree failure,"Relayed, tested NG; SUS Chicago Park PH (off-line); DutchFlat #1 PH separated; weather clear; 1432 to 2034 ChicagoPark-Higgins cleared to repair ET wire down at twr 23/180 -pine tree outside ROW failed",11017,VD-2015-022,0,0,0,0.0000,0.000,0,"5,446,629",NA,NA,No
CENTRAL,60,ETL.8330,60234,WEBER-MORMON JCT,0,000/004-000/008,Non-HFTD,2015,03/30/2015 08:28,No,No,NO,No,21:12,03/31/2015 05:40,External Contact,Car pole,"Relayed -- 03/30/15, 0828 Bellota-Weber relayed, tested NG after carpole on Weber-MormonJct & failure of Weber CB-12 to clear fault; Weber-Tesla open ended momentarily at Weber; StocktonA-Weber #1, 2 & 3, Weber-MormonJct & Weber #1 de-energized; MOM multiple subs in area & SUS Mormon sub & Weber 1102; ET wire down outside Mormon (carpole) & Weber subs (CB-12); eventID=11014 & 11016",11014,TE-2015-012,"4,234","2,022",TBD,TBD,TBD,TBD,"5,446,629",NA,NA,No
SOUTH,70,ETL.9270,70087,WEEDPATCH-SAN BERNARD,0,006/111,Non-HFTD,2015,04/07/2015 16:38,No,No,NO,No,11:30,04/08/2015 04:08,Equipment Failure,Structure-line,"Relayed - 04/07/15, 1638 Weedpatch-SanBernard relayed, tested NG; SUS Arvin (574, 18,942); Orion separated; rain; electromech relays at SanBernard CB32 so no fault data; Weedpatch CB42 is N.O. summer setup; 1711 Weedpatch-Orion tested OK, restoring Arvin; 1812 Orion restored; patrol in progress; fault info from remote Wheeler CB42: 2.5 MI FROM SAN BERNARD CB32 TOWARDS ORION PV TAP; 2009 SanBernard-OrionJct cleared to replace pole fire at 6/111 w/ ET wire fallen into 12kV u-build; 2011 Orion paralleled; 04/08/15, 0408 line returned normal; eventID=11063",11063,MD-2015-017,619,619,"22,346",0.0001,0.004,36,"5,446,629",NA,NA,No
SOUTH,115,ETL.1923,10488,OLIVE SW STA-SMYRNA,0,"057/434, 057/436-437",Non-HFTD,2015,04/12/2015 09:31,No,No,NO,No,10:41,04/12/2015 20:12,Equipment Failure,Conductor,"Relayed - 04/12/15, 0931 OliveSwSta-Smyrna relayed, tested NG; Corcoran-OliveSS & Olive-WhiteRiver de-energized; SUS Atwell, WhiteRiver PV, WhiteRiver West, Alpaugh, Alpaugh-N & Quebec; weather clear; 0942 Corcoran-OliveSS energized from Corcoran restoring Quebec, Alpaugh & Alpaugh-N; FIRST FAULT: A-G FAULT, THEN A-C -G  WHEN LINE TESTED AFTER  15 secs, 10 MILES FROM SMYRNA TWD OLIVE SS, 1. 5 MI FROM OLIVE SS TWD ATWELL PV JCT TAP (near pole 57/434 on OliveSS-Smyrna, +/- 1 mile); 1205  OliveSS-WhiteRiver energized restoring WhiteRiver PV & WhiteRiver West; 1246 Smyrna CB112 closed to open AtwellJct SW197 energizing Atwell; 1336 OliveSS-AtwellJct cleared to repair ET wire down bet twrs 57/436-437; 1348  OliveSS 115kV bus returned normal; 2012 line returned normal; eventID=11037",11037,FR-2015-017,338,338,"3,718",0.0001,0.001,11,"5,446,629",NA,NA,No
CENTRAL,60,ETL.7460,60141,MANTECA #1,0,002/041-042,Non-HFTD,2015,04/21/2015 12:39,No,No,NO,No,8:25,04/21/2015 21:04,Equipment Failure,Connector/ hardware,"Forced - 04/21/15, 1239 Manteca #1 forced out due to single-phase condition; SUS Banta Carbona & Westley; 1422 PattersonJct-MantecaJct energized, restoring Banta Carbona & Westley; 1422 MantecaJct-LeeJct cleared to repair ET wire down bet poles 2/41-42 (failed splice); 1649 Manteca-LeeJct manually tested OK; 2104 line returned to service; eventID=11061",11061,TE-2015-021,"1,593","1,593","184,381",0.0003,0.034,116,"5,446,629",NA,NA,No
NORTH,60,ETL.6921,60087A,ELK CREEK TAP,0; 245; 246,003/072,Non-HFTD,2015,05/07/2015 03:25,No,No,NO,No,6:35,05/07/2015 10:00,Equipment Failure,Connector/ hardware,"Relayed - 05/07/15, 0325 ElkCreek tap de-energized; SUS StonyGorge PH (offline) & ElkCreek; 0653 ElkCreekJct-ClarkValleyRd cleared to repair ET wire down at pole 3/72 due to compression splice failure; eventID=11098",11098,TM-2015-041,908,908,"366,832",0.0002,0.067,404,"5,446,629",NA,NA,No
SOUTH,70,ETL.8540,70110,CARNERAS-TAFT,0,"124/038, 022/350",Non-HFTD,2015,05/07/2015 23:50,No,No,NO,No,12:25,05/08/2015 12:15,Equipment Failure,Conductor,"Relayed - 05/07/15, 2350 Carneras-Taft relayed, tested NG; SUS McKittrick, MidwayPipeline-S & Celeron; wind; A-B fault 19.5 mi from Taft twds Carneras near 124/38 (SWS 29 & 47), +/- 2 mi; 05/08, 0127 Taft-McKittrickJct tested OK from Taft restoring McKittick & MPS;  0216 Caneras-TemblerJct tested OK restoring Celeron; 1215 line normal, replaced bunt pole 22/350, ET wire down across Temblor 1104 under build; eventID=11101",11101,MD-2015-022,153,153,"14,841",0.0000,0.003,97,"5,446,629",NA,NA,No
SOUTH,115,ETL.2120,10138,LERDO-FAMOSO,0,005/045 & 005/046,Non-HFTD,2015,05/27/2015 21:34,No,No,NO,No,18:23,05/28/2015 15:57,External Contact,Car pole,"Relayed - 05/27/15, 2134 Lerdo-Famoso relayed, tested NG; SUS CaweloC, Famoso, UltraPwr cogen (offline); MtPoso cogen separated; weather clear; replaced downed poles 05/45 & 05/46 caused by tractor (ET wire down); eventID=11147",11147,MD-2015-0427,615,615,"36,900",0.0001,0.007,60,"5,446,629",NA,NA,No
NORTH,115,ETL.4395,10398,BELL-PLACER,300,004/030-031,Tier 2 - Elevated,2015,06/05/2015 19:38,No,No,NO,No,22:20,06/06/2015 17:58,Weather,Lightning,"Relayed - 06/05/15, 1938 Bell-Placer relayed, tested NG; no customer interruption; A-B-C fault 0.77 mi from Placer (GIS shows lightning) near structure 004/031, +/- 0.5 mi; replaced ET wire down & NG top phase insl on pole 4/30",11176,VD-2015-057,0,0,0,0.0000,0.000,0,"5,446,629",NA,NA,No
SOUTH,70,ETL.9340,70094,WISHON-SAN JOAQUIN #3,424; 427,"005/003, 005/015, 006/002-003",Tier 2 - Elevated,2015,06/18/2015 20:48,No,No,NO,No,67:42,06/21/2015 16:30,Disaster,Fire,"Relayed - 06/18/15, 2048 Wishon-SJ#3 relayed, tested NG; SUS SJPH2 (offline), SJPH3 (offline) & CraneValley PH (offline); weather clear, Corrine fire; replaced damaged insulators at pole 5/3, replaced pole 5/15, repaired ET wire down, replaced insulators & reframed pole 6/3 & re-sagged conductor at pole 6/2",11198,FR-2015-034,"2,907","2,907","537,088",0.0005,0.099,185,"5,446,629",NA,NA,No
SOUTH,70,ETL.8610,70019,DINUBA-OROSI,0,014/005 & 014/006 ,Non-HFTD,2015,07/05/2015 12:28,No,216; 243; 249; 255,NO,No,16:24,07/06/2015 04:52,External Contact,Car pole,"Relayed - 07/05/15, 1228 Dinuba-Orosi 70kV relayed, tested NG; MOM StoneCorral (1,913); 1230 Dinuba-StoneCorral manually tested NG; 1232 Orosi-StoneCorral manually tested OK restoring StoneCorral; weather clear; 1441 Dinuba-StoneCorralJct cleared to replace poles 14/5 & 14/6 due to car pole; 07/06/15, 0452 Dinuba-Orosi returned to service after crew replaced poles & downed conductor; eventID=11233",11233,FR-2015-043,"1,913",0,0,0.0000,0.000,0,"5,446,629",NA,NA,No
CENTRAL,115,ETL.1481,10061A,LOWER LAKE-HOMESTAKE,175,006/002-009/001,Tier 2 - Elevated,2015,07/29/2015 21:52,No,100; 112; 113; 115; 230,NO,No,147:33,08/05/2015 01:25,Disaster,Fire,"Relayed - 07/29/15, 2152 LowerLake-Homestake 115kV relayed, properly did not test; SUS Homestake rock quarry; weather clear; 07/30/15, 0525 report of multiple poles bet 6/2-9/1 damaged & limited access due to ""Rocky"" fire; A-B fault; 08/01/15, 1859 & 1908 EagleRock-Cortina & Cortina-Mendo#1 forced out for safety due to fire;  08/05/15, 0125 ER-LowerLakeTap & LowerLake-Homestake returned to service after replacing 31 poles & reframing 8 poles & repairing several sections of ET wire down damaged by fire; remaining sections of ER-Cortina & Cortina-Mendo#1 to remain de-energized pending approval from CalFire",NONE,FU-2015-037,1,0,0,0.0000,0.000,0,"5,446,629",NA,NA,No
CENTRAL,70,ETL.8960,70056,LOS BANOS-PACHECO,0,007/003,Non-HFTD,2015,08/01/2015 05:27,No,No,NO,No,16:50,08/01/2015 22:17,Disaster,Fire,"Relayed - 08/01/15, 0527 (aware time 0546) LB-Pacheco 70kV relayed, properly did not test; SUS Dinosaur Point International Wind Turbine (offline) & Pacheco PP; weather clear, GIS shows no lightning; EM RELAYS ON LB CB-22 NO FAULT LOCATION POSSIBLE; 0549 line manually tested NG; 1015 to 2217 line cleared to replace burnt down pole 007/003 (fire in area due to 3rd party vehicle) & repair ET wire down",11314,LB-2015-025,1,0,0,0.0000,0.000,0,"5,446,629",NA,NA,No
