,,,,,,,,,,,,,,,,,,,,,,,,,,,,,,
SOUTH,60,ETL.8068,60426,SUTTER HOME SW STA-LOCKEFORD-LODI,0,003/041-042,Non-HFTD,2016,03/03/2016 19:52,No,No,NO,No,12:55,03/04/2016 08:47,External Contact,Car pole,"Relayed - 03/03/16, 1952 SHSS-Lockeford-Lodi relayed, tested NG; SHSS-Stagg (SHSS-StaffJct), SH-SHSS & SebastWinery tap de-energized; SUS Colony (1,046, 165,268), NewHope (974, 153,892), Terminous (526, 87,842), ConstBrandsVintners & SH Winery; 2230 Lodi-SHSS sect returned to service restoring Colony & NewHope; 2240 SHSS-Stagg #1 (SHSS-StaffJct) returned to service restoring Terminous & ConstelVintners; 2245 SH-SHSS returned to service restoring SH Winery; 2319 SHSS-Lockeford-Lodi (Lockeford-ColonyJct sect) cleared to repair ET wire down bet poles 3/41-42 (w/ 12kV under build (Victor 1102) on grd) & replace damaged pole 3/42 due to carpole; C-G fault 2.5 mi from Lockeford (matches carpole location); 03/04/16, 0847 SHSS-Lockeford-Lodi returned to service; eventID=11964",11964,TE-2016-013a,"2,546","2,546","407,002",0.0005,0.075,160,"5,481,869",NA,NA,No
NORTH,60,ETL.7710,60168,NICOLAUS-WILKINS SLOUGH,0,001/021-022,Non-HFTD,2016,03/05/2016 21:49,YES,No,NO,No,6:21,03/06/2016 04:10,Tree,Tree failure,"Relayed - 03/05/16, 2149 Vaca-PlainfieldJct relayed, tested OK; Nicolaus-PlainfieldJct & Nicolaus-WilkinsSlough de-energized; 2150  Vaca-Plainfield section tested OK; MOM Winters (703) & Plainfield (4,136); SUS Dist 1001 & Carnack; wind, rain, declared MED; B-C fault 3 mi from Dist 1001 near 008/173 or at Dist 1500 60kV bus (line abnormal due to clearances); 03/06/16, 0410 Nicolaus-PJ & Nicolaus-WS returned to service restoring Carnack; 1045 Dist 1001 Tap returned to returned to service normal after repairs to ET & ED wire down bet poles 1/21-22 due to tree failure",11974,VD-2016-012c,0,0,0,0.0000,0.000,0,"5,481,869",NA,NA,No
NORTH,115,ETL.3460,10280,RIO OSO-WOODLAND #1,0,033/220-221,Non-HFTD,2016,03/06/2016 03:04,No,No,NO,No,19:00,03/06/2016 22:04,Equipment Failure,Structure-line,"Relayed - 03/06/16, 0304 RioOso-Woodland #1 relayed, tested NG; SUS KnightsLanding (1,095, 133,590), restored @ 0506; A-B-G fault 0.1 mi from Madison near pole 34/235, +/- 1 mi; RidgeCutJct-Madison cleared to repair ET wire down & fallen poles 33/220-221; 2204 sect returned to service, line normal; no trees, but strong winds, heavy rain present",11978,VD-2016-013,"1,095","1,095","133,590",0.0002,0.025,122,"5,481,869",NA,NA,No
NORTH,60,ETL.7850,60184,RIO DELL JCT-BRIDGEVILLE,0; 100; 105; 120,0 31/001-003,Tier 2 - Elevated,2016,03/06/2016 12:13,No,No,NO,No,10:46,03/06/2016 22:59,Tree,Tree failure,"Relayed - 03/06/16, 1213 RioDellJct-Bridgeville relayed, tested NG, sectionalized & manually tested OK from RioDellJct; MOM HumboldtRedwood & Carlotta (1,095); wind, rain; A-C-G fault 9.6 mi from Bridgeville near pole 31/1, +/- 0.5 mi; tree branch fell into line - ET wire down (center phase) bet poles 31/2-3; 2259 Bridgeville-Carlotta returned to service making line normal; eventID=11970",11970,HM-2016-008,"1,095",0,0,0.0000,0.000,0,"5,481,869",NA,NA,No
NORTH,60,ETL.6480,60039,COLGATE-CHALLENGE,282; 330,005/111-114,Tier 3 - Extreme,2016,03/07/2016 05:25,No,No,NO,No,14:53,03/07/2016 20:18,Equipment Failure,Conductor,"Relayed - 03/07/16, 0525 Colgate-Challenge relayed, tested NG; SUS Dobbins (890, 125,490) & Challenge (1,568, 20,889), wind, rain, snow, ice; ETA to Dobbins SW-27=2 hrs; 0540 all Challenge customers restored via back-ties; A-G fault 13 mi from ColgateSwSta (close to Challenge sub) near structure 12/221. . .possibly w/in Challenge Sub,+/- 5 miles (very high impedance fault, may be 12kV underbuild fault, if any); 0746 Challenge SW-19 opened to isolate trouble & ET restored to Dobbins; 1023 Dobbins-Challenge manually tested NG after patrol reported no trouble; MOM Dobbins (890); 1024 Colgate-Dobbins returned to service, restoring Dobbins; 1043 to 2018 Dobbins-Challenge cleared to repair ET wires down bet poles 5/111-112 & bet 5/113-114",12021,TM-2016-017,"2,458","2,458","146,479",0.0005,0.027,60,"5,481,869",NA,NA,No
NORTH,60,ETL.2060,60389,FORT BRAGG-ELK,0; 140,008/002-003,Tier 2 - Elevated,2016,03/12/2016 09:37,No,No,NO,No,13:04,03/12/2016 22:41,Tree,Tree failure,"Relayed, tested NG; MOM BigRiver (2,556); rain; re-sag one span 397 Al conductor bet 8/2-3 & make temp repairs to cracked pole 8/3 due to tree failing",12000,FU-2016-018,"2,566",0,0,0.0000,0.000,0,"5,481,869",NA,NA,No
NORTH,60,ETL.7520,60148,MENDOCINO-PHILO JCT-HOPLAND,154,002/006-009,Tier 2 - Elevated,2016,03/29/2016 21:23,No,No,NO,No,9:29,03/30/2016 06:52,Tree,Tree failure,"Relayed - 03/29/16, 2123 Mendo-PhiloJct-Hopland relayed, tested NG; no customer interruption; weather clear; B-G fault 3 mi from Mendo, +/- 0.5 mi; 03/30/16, 0049 Hopland-PhiloJct manually tested OK; 0210 Mendo-PhiloJct cleared to replace broken xarms & re-attach ET wire down bet poles 2/6-9; 0652 line returned to normal service; eventID=12046",12046,FU-2016-022,0,0,0,0.0000,0.000,0,"5,481,869",NA,NA,No
NORTH,60,ETL.7270,60122,KESWICK-TRINITY,230; 241; 246,018/258-259,Tier 2 - Elevated,2016,03/31/2016 10:04,No,No,NO,No,11:11,03/31/2016 21:15,Equipment Failure,Conductor,"Relayed - 03/31/16, 1004 Keswick-Trinity relayed, tested NG; Trinity-Lewiston restored by autos; SUS FrenchGulch (327, 27,468); weather clear; 1130 ET restored to French Gulch; C-G fault, location estimate not possible as extremely high impedance fault; 1 span of C-phase ET wire down bet 18/258-259; 2115 line returned to service normal",12053,RM-2016-018,327,327,"27,468",0.0001,0.005,84,"5,481,869",NA,NA,No
SOUTH,115,ETL.1730,10089,GREEN VALLEY-PAUL SWEET,0; 500; 520,005/067-068,Tier 2 - Elevated,2016,04/07/2016 05:08,No,No,NO,No,16:14,04/07/2016 21:22,Tree,Tree failure,"Relayed - 04/07/16, 0508 GreenValley-PaulSweet relayed, tested OK; PaulSweet STATCOM tripped out of section; MOM RobRoy (11,662); weather clear; 0809 GV-RR cleared to remove large eucalyptus tree & repair ET wire down bet structures 5/67-68; A-B-C fault & matches loc found in field; 1245 PaulSweet STATCOM cleared for stn to investigate; 2122 line normal; ETOR 04/15; eventID=12072",12072,ML-2016-008,"11,662",0,0,0.0000,0.000,0,"5,481,869",NA,NA,No
SOUTH,115,ETL.4000,10336,TESLA-SALADO-MANTECA,0; 540,022/123,Non-HFTD,2016,04/10/2016 21:33,No,No,NO,No,20:07,04/11/2016 17:40,Equipment Failure,Conductor,"Relayed - 04/10/16, 2133 Tesla-Salado-Manteca relayed, tested NG; SUS IngramCreek; weather cloudy; A-B-C fault 2 mi s/o IngramCreek Tap twd Salado near structure 022/123; revised - A-B-C fault 1.68 mi from SaladoJct twd open SW-325 at Miller sub near structure 30/000; 04/11/16, 0845 to 1740 Miller#2 tap cleared to repair ET wire down @ 29/8, replace burnt pole top & re-hang two floators; 0919 line manually tested OK, 0923 line returned to service restoring Ingram Creek; eventID=12086",12086,TE-2016-020,1,0,0,0.0000,0.000,0,"5,481,869",NA,NA,No
SOUTH,70,ETL.8910,70051,KINGSBURG-LEMOORE,0,002/022-024,Non-HFTD,2016,04/24/2016 23:44,No,No,NO,No,15:47,04/25/2016 15:31,External Contact,Car pole,"Relayed - 04/24/16, 2344 Kingsburg-Lemoore relayed, tested NG; SUS Hardwick (2,066, 181,808); weather clear; A-B-C-G fault 2 mi from HanfordSS twd Lemoore near structure 2/5, +/- 1.0 mi; 04/25/16, 0112 Kingsburg-Hardwick returned to service restoring Hardwick; 0251 to 1531 HanfordSwSta-Lemoore cleared to replace pole 2/22 due to carpole & to repair ET Wire Down bet 2/23-24; eventID=12129",12129,FR-2016-022,"2,606","2,606","181,808",0.0005,0.033,70,"5,481,869",NA,NA,No
NORTH,60,ETL.7710,60168,NICOLAUS-WILKINS SLOUGH,0,0/19-1/22,Non-HFTD,2016,04/25/2016 12:19,No,No,NO,No,4:47,04/25/2016 17:06,Tree,Tree failure,"Forced - 04/25/16, 1219 to 1706 District 1001 60kV Tap forced out to repair ET wire down bet poles 0/19-1/22 (line had relayed, tested OK 2x earlier in the day) due to tree failure; SUS District 1001; eventID=12130",12130,VD-2016-1109,1,0,0,0.0000,0.000,0,"5,481,869",NA,NA,No
SOUTH,70,ETL.9160,70076,SCHINDLER-HURON-GATES,0,006/005-007 ,Non-HFTD,2016,05/05/2016 19:17,No,No,NO,No,21:54,05/06/2016 17:11,Weather,Lightning,"Relayed - 05/05/16, 1917 Schindler-Huron-Gates & StroudSS-Schindler relayed, tested NG (lines effectively one due to scheduled B&C of Schindler CB-32); SUS Calflax (269, 62,320); rain; A-B-C fault 2.7 mi from Calflax twd Huron near structure 11/9, +/- 2 mi; 2231 Schindler-Calflax tested NG; 2315 Gates-Calflax tested OK, restoring Calflax; 05/06/16, 0520 to 1711 StroudSS-Schindler cleared to repair 2 phases ET wire down & replace insulators bet poles 6/5-7 due to lightning",12162,FR-2016-027a,269,269,"62,320",0.0000,0.011,232,"5,481,869",NA,NA,No
SOUTH,70,ETL.8440,70002,ARCO-CHOLAME,0; 495,"009/096, 9/97 & 9/98, 009/102 & 010/103, 010/106 & 010/107",Non-HFTD,2016,05/06/2016 17:36,No,No,NO,No,27:09,05/07/2016 20:45,Weather,Lightning,"Relayed - 05/06/16, 1736 Arco-Cholame 70kV relayed, tested NG; MOM BerrendaA, BerrendaC, Antelope (173) & DevilsDen (172); SUS Cholame  (1,532, 1,019,103); lightning; A-B-C fault 0.5 mi from BerrendaJct twd Cholame near pole 008/94, +/- 1 mi; 2249 BerrendaJct-Cholame cleared to replace insulators at 9/96, 9/97 & 9/98 & reframe pole 9/98; 05/07/16, 0430 BerrendaJct-Cholame manually tested NG; MOM DevilsDen, BerrendaA, BerrendaC & Antelope (173); terrain muddy, difficulty navigating area; 0950 BerrendaJct-Cholame cleared to replace insulators at 9/102 & reframe 10/103, replace broken poles 10/106 & 10/107; center phase found broken and on ground at pole 9/107; 2044 Arco-BerrendaJct de-energized to test Arco-Cholame; MOM DevilsDen (173); 2045 Arco-Cholame returned to service restoring DevilsDen & Cholame  MD-2016-0641",12163,MD-2016-0641,"1,532","1,532","1,019,103",0.0003,0.187,665,"5,481,869",NA,NA,No
NORTH,60,ETL.6470,60038,COLGATE-ALLEGHANY,330; 350,019/535-536,Tier 3 - Extreme,2016,05/24/2016 10:18,No,No,NO,No,9:26,05/24/2016 19:44,Tree,3rd party,"Relayed - 05/24/16, 1018 Colgate-Alleghany relayed, tested NG; 1020 Colgate-PikeCity manually tested OK; MOM ColumbiaHill (1,134) & PikeCity (439); SUS Alleghany (CESO=1,224; CMIN=524,454); weather cloudy; B-C fault 16.8 mi from ColgateSS near 016/447, +/- 2 mi; 1254 to 1944 PlumValley-BuhlRanch cleared to repair 3 phases of ET wire down bet 19/535-536 due to 3rd party tree trimmers felling tree into line; SH&C notified",12194,TM-2016-030,"2,794","1,224","524,454",0.0002,0.096,428,"5,481,869",NA,NA,No
SOUTH,70,ETL.8960,70056,LOS BANOS-PACHECO,0,087/381-382,Non-HFTD,2016,06/07/2016 16:03,No,No,NO,No,21:29,06/08/2016 13:32,Equipment Failure,Conductor,"Relayed - 06/07/16, 1603 LosBanos-Pacheco relayed, tested NG; SUS DinosaurPt (offline) & PachecoPP; weather clear, windy; 2351 line cleared to repair ET wire down in the H2O bet twrs 87/381-382 @ aqueduct & HWY-33, contacted pedestrian in area who was released from hospital ~2 hrs later; appears failure point was at dead end clamp and vibration due to high winds; 06/8/16, 1332 line returned to service; eventID=12236",12236,LB-2016-015,2,0,0,0.0000,0.000,0,"5,481,869",NA,NA,No
SOUTH,115,ETL.1560,10070,EXCHEQUER-LE GRAND,0,024/002-003,Non-HFTD,2016,06/10/2016 14:58,No,No,NO,No,7:13,06/10/2016 22:11,Equipment Failure,Connector/ hardware,"Relayed - 06/10/16, 1458 Exchequer-LeGrand relayed, tested NG; no customer interruption but Exchequer PH separated; weather clear; 1636 PH paralleled; C-G fault 4.5 mi from LeGrand near 024/007, +/- 3 mi; 1745 to 2211 line cleared to repair of ET wire down center phase bet poles 24/2-3 due to hotspot right at connector link ",12246,LB-2016-016,0,0,0,0.0000,0.000,0,"5,481,869",NA,NA,No
SOUTH,115,ETL.3710,10305,SMYRNA-SEMITROPIC-MIDWAY,0,075/579,Non-HFTD,2016,07/01/2016 04:00,No,No,NO,No,9:46,07/01/2016 13:46,Equipment Failure,Conductor,"Relayed - 07/01/16, 0400 Smyrna-Semitropic-Midway relayed, tested NG; Semitropic 115/70kV BK1, Semitropic-Wasco 70kV, Corcoran-OliveSS, OliveSS-Smyrna, Semitropic-Charca, Smyrna-PondRoad, Charca-Famoso & OliveSS-WhiteRiver de-energized; MOM Wasco & Famoso; SUS Alpaugh, Quebec (offline), Alpaugh North (offline), WhiteRiver PV (offline), WhiteRiver West (offline), Atwell (offline), Atwell West (offline), PondRd, Smyrna, Ganso, WascoPrison & Charca; weather clear; A-C fault 0.5 mi from Semitropic near 75/579, +/- 0.5 mi; 0756 to 1343 line cleared to re-attach ET wire down on grd & across Semitropic 1104 at pole 75/579; eventID=12286",12286,MD-2016-031a,"1,157","4,760","477,224",0.0009,0.088,100,"5,481,869",NA,NA,No
NORTH,60,ETL.8410,60244,ELK-GUALALA,0; 140,066/000,Tier 2 - Elevated,2016,07/06/2016 08:03,No,No,NO,No,12:49,07/06/2016 20:52,Tree,3rd party,"Relayed - 07/06/16, 0803 Elk-Gualala relayed, tested NG; SUS PtArena (900, 17,100) & Garcia (9, 7,002); fog; 0822 Elk-PtArena returned to service restoring PtArena; A-B-G fault 6.8 mi from Garcia Jct twd Gualala or 2.8 mi from Garcia Jct twd Garcia near structure 66/000 twd Gualala or structure 002/009 twd Garcia, +/- 3 mi; 0902 Garcia tap cleared due to tree in line & 2 phases of ET wire down bet poles 1/4-5; 0906 Elk-Gualala returned to service, Garcia customers to remain out for duration, back ties unavailable; 2052 Garcia tap returned to service; eventID=12297",12297,FU-2016-044,909,909,"24,102",0.0002,0.004,27,"5,481,869",NA,NA,No
SOUTH,70,ETL.8550,70113,CARUTHERS-LEMOORE NAS-CAMDEN,0,018/012,Non-HFTD,2016,07/21/2016 08:26,No,No,NO,No,6:54,07/21/2016 15:20,External Contact,Aircraft,"Relayed - 07/21/16, 0826 Henrietta-LemooreNAS relayed, tested NG & Caruthers-LemooreNAS-Camden de-energized (lines tied together due to summer setup); SUS Caruthers 70/12kV BK2 & LemooreNAS, also 70kV fell into Camden 1104; weather clear; 0834 Caruthers BK2 restored via Kearny-Caruthers; 0930 Henrietta-Lemoore NAS & section of Caruthers-LemooreNAS-Camden tested OK restoring LemooreNAS; 1038 Camden-CamdenJct to replace ET wire down at structure 18/12 from crop duster contact; 1520 Camden-CamdenJct returned to service eventID=12335",12335,FR-2016-052a,"2,086","2,086","115,476",0.0004,0.021,55,"5,481,869",NA,NA,No
SOUTH,60,ETL.7380,60133,LAURELES-OTTER,505; 507; 550; 560,00700/0-013/002,Tier 3 - Extreme,2016,07/23/2016 19:08,No,448; 510; 512; 585; 586; 588; 651; 652; 666,NO,No,429:29,08/10/2016 16:37,Disaster,Fire,"Relayed - 07/23/16, 1908 Laureles-Otter relayed, tested NG; SUS Otter (CESO=1,114; CMIN=274,775); weather clear, Soberanes fire in area; A-B fault 30 mi from Salinas (vicinity of Soberanes fire); 07/24/16, 0001 Otter customers restored via distribution back-ties; 2359 line cleared to repair ET wire down & 9 poles down when CALFIRE determines it's safe to do so; no ETOR",12390,ML-2016-021,"1,114","1,114","274,775",0.0002,0.050,247,"5,481,869",NA,NA,No
NORTH,115,ETL.3180,10248,OLEUM-NORTH TOWER-CHRISTIE,0; 530,A04/030-031,Tier 2 - Elevated,2016,07/24/2016 16:28,No,448; 510; 512; 585; 586; 588; 651; 652; 666,NO,No,15:21,07/25/2016 07:49,Equipment Failure,Conductor,"Relayed - 07/24/16, 1624 Oleum-NTower-Christie relayed, did not test; MOM N-Tower; weather clear; 2154 line cleared to repair ET wire down on Hwy 4 bet twrs A4/30-31; no report of injuries, nearby fire extinguished; 07/25/16, 0749 line returned to service after re-attaching conductor at  towers A4/30 & A4/31; NTower xfrd back to normal source",12351,PS-2016-013,"25,199",0,0,0.0000,0.000,0,"5,481,869",NA,NA,YES
SOUTH,115,ETL.1720,10088,GREEN VALLEY-LLAGAS,0; 520; 553,"009/067, 009/066 & 009/065",Tier 3 - Extreme,2016,08/12/2016 19:01,No,No,NO,No,908:00,09/19/2016 15:01,Disaster,Fire,"Relayed - 08/12/16, 1901 GV-Llagas (GreenValley-MorganHil Jct) relayed, tested NG; no customer interruption; weather clear, 'Oak' fire in area; RPTS POLES 9/67, 9/66 & 9/65 ARE GOING TO NEED TO BE REPLACED AT A MINIMUM & AT LEAST ONE PHASE DOWN ON GROUND",12416,ME-2016-008,0,0,0,0.0000,0.000,0,"5,481,869",NA,NA,No
SOUTH,70,ETL.8700,70029,GATES-TULARE LAKE,0,006/007-008,Non-HFTD,2016,08/27/2016 06:34,No,No,NO,No,9:54,08/27/2016 16:28,Equipment Failure,Conductor,"Forced - 08/27/16, 0634 Gates-TulareLake (Gates-Kettleman Hills Jct) forced out due to single phasing condition on Kettleman Hills #1-70/12kV xfmr; SUS Kettleman Hills (1,039; CMIN=89,157); weather clear; 0815 ET service restored to KettlemanHills; 1628 line returned to service normal; caused by one phase of ET wire down bet structures 006/007-008 w/ ED under build; small grass fire in area; eventID=12439",12439,FR-2016-058,"1,039","1,039","89,157",0.0002,0.016,86,"5,481,869",NA,NA,YES
SOUTH,70,ETL.9160,70076,SCHINDLER-HURON-GATES,0,011/002,Non-HFTD,2016,09/15/2016 09:48,No,No,NO,No,12:41,09/15/2016 22:29,External Contact,Car pole,"Relayed - 09/15/16, 0948 Schindler-Huron-Gates relayed, tested NG; SUS Calflax (CESO=284; CMIN=34,168); weather clear; B-G fault 11.1 mi from Schindler near 11/001, +/- 2mi; Calflax 1102 circuit has been isolated; 1128 Schindler-Calflax manually tested OK restoring Calflax; 1149 to 2229 Calflax-Huron cleared to replace ET wire down & pole 11/2 damaged by tractor (fatality); 1155 Gates-Huron returned to service",12496,INT-08533,284,284,"34,168",0.0001,0.006,120,"5,481,869",NA,NA,No
NORTH,60,ETL.7550,60151,MENDOCINO-WILLITS-FORT BRAGG,0; 140; 154,037/000-001,Tier 2 - Elevated,2016,10/01/2016 04:07,No,No,NO,No,21:57,10/02/2016 02:04,External Contact,Vandalism,"Relayed - 10/01/16, 0407 Mendo-Willits-FtBragg relayed, tested NG; no customer interruption, weather cloudy; A-C-B fault 4.67 mi from FtBragg twd Mendocino & Willits near pole 037/006, +/- 0.5 mi; 0733 Tman reports tree was saw cut & fell into our line to bring down wires & steel pole 37/0; 0728 Mendo-Willits returned to service; 1003 McGuireMillJct-FtBragg cleared to repair ET wire down at pole 37/1; 1303 Mendo sheriff on way to scene; 10/02/16, 0204 line returned to service normal after installing temp pole in place of damaged 37/1 & repaired 3 phases of ET wire down due to unauthorized tree cut; eventID=12538",12538,INT-08597,0,0,0,0.0000,0.000,0,"5,481,869",NA,NA,No
NORTH,60,ETL.7630,60160,MONTE RIO-FULTON,0; 140; 180,001/014,Non-HFTD,2016,10/05/2016 07:34,No,448; 510; 512; 585; 586; 588; 651; 652; 666,NO,No,12:45,10/05/2016 20:19,External Contact,Car pole,"Relayed - 10/05/16, 0734 MR-Fulton relayed, tested NG; on trouble MR-FtRoss & FtRoss-Gualala de-energized; MOM Gualala (CEMO=3,736); SUS Annapolis (CESO=230; CMIN=3,680), FtRoss (CESO=640; CMIN=10,240), SalmonCreek (CESO=1,543; CMIN=26,231), Monte Rio (CESO=7,017; CMIN=912,210), Wohler & Mirabel (CESO=3,954; CMIN=520,132); light rain; 0748 Gualala-FtRoss energized restoring Annapolis; 0751 FtRoss-MR returned to service restoring FtRoss & SalmonCreek; 0813 restored MonteRio from Elk; A-B fault 4.5 mi from Fulton twd MR near twr 004/004, +/- 1 mi; 0919 to 2019 Fulton-Wohler JCT to Trento JCT sect cleared to replace pole 1/14 damaged by car & repair ET wire down; 0944 Molino-Mirabel-Wohler sect returned to service restoring Mirabel & Wohler; eventID=12549",12549,INT-08622a,"17,131","13,385","1,473,493",0.0025,0.271,110,"5,481,869",NA,NA,No
NORTH,60,ETL.7560,60152,WEIMAR #1,330; 340,006/093-094,Tier 3 - Extreme,2016,10/11/2016 23:16,No,No,NO,No,7:50,10/12/2016 07:06,External Contact,Vandalism,"Relayed - 10/11/16, 2316 Weimar#1 relayed, tested NG; on the trouble FrenchMeadows-MiddleFork & MiddleFork#1 de-energized; SUS ForestHill (CESO=2,634; CMIN= 1,274,369); Oxbow, FrenchMeadows & HellHole PHs separated; weather clear; alt ET backtie out on clearance for NERC tower work; 10/12/16, 0151 Oxbow PH restored ET service to Forest Hill as isolated load; 0228 Weimar-ForestHill cleared to repair ET wire down bet poles 6/93-94; 0253 Oxbow PH tripped during load restoration causing SUS ForestHill; 0706 Weimar#1 returned to service restoring MiddleFork #1, FrenchMeadows-MiddleFork & ForestHill; 0713 Oxbow PH paralleled; 0800 FrenchMeadows PH paralleled; eventID=12560",12560,INT-08640a,"2,634","2,634","1,274,369",0.0005,0.234,484,"5,481,869",NA,NA,YES
SOUTH,70,ETL.8700,70029,GATES-TULARE LAKE,0,010/000-002,Non-HFTD,2016,10/16/2016 18:22,No,No,NO,No,44:00,10/18/2016 14:22,Equipment Failure,Structure-line,"Relayed - 10/16/16, 1822 Gates-TulareLake relayed, tested NG; SandDrag Cogen separated; MOM KettlemanHills (CEMO=1,040); SUS Chevron Pipeline Kettleman, Avenal (CESO=1,944; CMIN=94,744), SunCity (offline) & Avenal Park (offline); rain, wind; AC-G fault 2.0 mi from TL sub near ChevronJct SW-69, +/- 1.0 mi; 2144 TL-Chevron Pipeline Kettleman JCT section returned to service restoring Chevron Pipeline Kettleman; 2334 Gates-Avenal JCT returned to service restoring Avenal, SandDrag, SunCity & AvenalPark; 2335 Avenal JCT to Chevron Pipeline Kettleman JCT section cleared to repair ET wire down & poles 10/0 to 10/2; ETOR 10/17; ",12579,INT-08682a,"2,984","1,944","94,744",0.0004,0.017,49,"5,481,869",NA,NA,No
SOUTH,70,ETL.8700,70029,GATES-TULARE LAKE,0,"009/008, 010/002-003",Non-HFTD,2016,10/18/2016 14:22,No,No,NO,No,8:05,10/18/2016 22:27,Equipment Failure,Structure-line,"Relayed - 10/18/16, 1442 Gates-TulareLake relayed, tested OK during return switching; MOM Kettleman Hills (CEMO=1,040) & Chevron Pipeline Kettleman; SUS Avenal (CESO=1,944; CMIN=77,760), Avenal Park (offline), Sand Drag (offline) and Sun City (offline); 1500 Gates-KettlemanHillsJct section forced out due to report of arcing conductor on Gates side of double dead end at pole 9/8; SUS KettlemanHills (CESO=1,040; CMIN=21,840); 1519 AvenalJct-ChevronKettlemanJct section cleared; 1521 Gates-KettlemanHillsJct section energized restoring KettlemanHills; 1522 KettlemanHillsJct-AvenalJct section returned to service restoring Avenal, Avenal Park, Sand Drag & Sun City; 2227 Gates-TulareLake returned normal after crew replaced poles 10/1 & 10/2 & re-hung 2 phases of ET wire down bet poles 10/2-3",12580,INT-08682b,"2,984","1,944","77,760",0.0004,0.014,40,"5,481,869",NA,NA,No
CENTRAL,115,ETL.3820,10316,STANISLAUS-MANTECA #2,0; 320; 345,015/088-089,Tier 2 - Elevated,2016,10/23/2016 18:10,No,335; 385; 440; 445; 448; 450; 651; 652; 666,NO,No,22:58,10/24/2016 17:08,Equipment Failure,Conductor,"Relayed - 10/23/16, 1810 Stanislaus-Manteca#2 relayed, tested NG; no customer interruption; weather clear; C-G fault 35.6 mi from Manteca near 29/176 (accuracy med); report of wire down bet twr 15/88-89, small fire was started; 10/24/16, 1708 line returned to service",12595,INT-08709,0,0,0,0.0000,0.000,0,"5,481,869",NA,NA,YES
CENTRAL,60,ETL.7670,60164,NEWARK-VALLECITOS,0; 530,092/598,Non-HFTD,2016,10/29/2016 12:43,No,No,NO,No,14:47,10/30/2016 03:30,External Contact,Foreign object,"Relayed - 10/29/16, 1221 Newark-Vallecitos & Radum-Vallecitos relayed, tested OK; Radum-Vallecitos remained open ended at Vallecitos; MOM Sunol, Vallecitos & Iuka; weather cloudy; 1243 Newark-Vallecitos open ended at Vallecitos due to single phasing condition; SUS Vallecitos; 1348 Radum-Vallecitos returned to service restoring Vallecitos; B phase fault 1.20 mi from Vallecitos near structure 091/596, +/- 1.0 mi; 1520 Newark-Vallecitos forced out, ET wire down due to mylar balloon at twr 92/598; SUS Sunol (CESO=726; CMIN=104,544); 1545 all customers restored at Sunol; 1717 Vallecitos-SunolJct cleared to re-attach conductor to twr 92/598; 10/30/16, 0330 Newark-Vallecitos returned normal replacing bells & 30' of conductor at twr 92/598  ",12610,T16-015221c,726,726,"104,544",0.0001,0.019,144,"5,481,869",NA,NA,No
CENTRAL,115,ETL.3840,10448,STANISLAUS-MELONES SW STA-RIVERBANK JCT SW STA,0; 320; 345,007/040-041,Tier 2 - Elevated,2016,11/20/2016 08:11,No,No,NO,No,14:25,11/20/2016 22:36,Equipment Failure,Conductor,"Relayed - 11/20/16, 0811 Stan-MelonesSS-RiverbkJctSS relayed, tested NG; no customer interruption, but Stanislaus PH separated; rain, fog; A-B-C fault 7.5 mi from MelonesSS near 18/108, +/- 3 mi; 1011 Stanislaus PH paralleled; 1247 to 2236 MelonesSS-MelonesJct cleared to repair ET wire down across the distribution & on ground bet 7/40-41 (wire separated under the shoe)",NONE,INT-08796,0,0,0,0.0000,0.000,0,"5,481,869",NA,NA,No
NORTH,60,ETL.2060,60389,FORT BRAGG-ELK,0; 140,016/003-005,Tier 2 - Elevated,2016,12/07/2016 23:44,No,No,NO,No,22:27,12/08/2016 22:11,Tree,Tree failure,"Relayed - 12/07/16, 2344 FtBragg-Elk relayed, tested OK; Big River SVC tripped offline; MOM BigRiver (CEMO=2,572); on the trouble FtBragg-BigRiver sectionalized & tested NG; rain; A-C-G fault 7.78 mi from FtBragg twd BigRiver near pole 16/5, +/- 1 mi; 12/08/16, 0006 BigRiver SVC returned to service; 2211 line returned to service normal after replacing pole 16/4 & repairing ET wire down bet 16/3-4 caused by fallen tree",NONE,INT-08850,"2,572",0,0,0.0000,0.000,0,"5,481,869",NA,NA,No
SOUTH,115,ETL.2050,10489,KINGSBURG-WAUKENA SW STA,0,021/164-165,Non-HFTD,2016,12/24/2016 21:23,No,No,NO,No,17:51,12/25/2016 15:14,Equipment Failure,Conductor,"Relayed - 12/24/16, 2123 Kingsburg-WaukenaSS relayed, tested NG; Corcoran PV (offline) & Corcoran PV West (offline) separated; weather clear; 2350 PVs paralleled; A-C fault 11 mi from Kingsburg near 21/161, +/- 2 mi; 12/25/16, 1514 line in service, replaced NG insulators at twr 12/165 & repaired ET wire down (top phase) bet 21/164-165",NONE,INT-08892,0,0,0,0.0000,0.000,0,"5,481,869",NA,NA,No
